{
  "schema_version": "1.0.0",
  "name": "HGX B300",
  "aliases": [],
  "manufacturer": "NVIDIA",
  "tier": "node",
  "release_date": null,
  "status": "shipping",
  "gpu_model_ref": "b300-sxm-hgx.json",
  "gpu_count": 8,
  "cpu_model": null,
  "cpu_count": 0,
  "cpu_core_count_total": null,
  "superchip_config": null,
  "total_fp64_tflops": null,
  "total_fp64_tensor_tflops": null,
  "total_fp32_tflops": null,
  "total_tf32_tensor_tflops": null,
  "total_tf32_tensor_sparse_tflops": null,
  "total_fp16_bf16_tensor_tflops": null,
  "total_fp16_bf16_tensor_sparse_tflops": null,
  "total_fp8_tensor_tflops": null,
  "total_fp8_tensor_sparse_tflops": 72000,
  "total_fp6_tensor_tflops": null,
  "total_fp6_tensor_sparse_tflops": 72000,
  "total_fp4_tensor_tflops": 108000,
  "total_fp4_tensor_sparse_tflops": 144000,
  "total_int8_tensor_tops": null,
  "total_int8_tensor_sparse_tops": null,
  "total_gpu_memory_gb": 2100,
  "total_gpu_memory_bandwidth_gbps": 62000,
  "total_cpu_memory_gb": null,
  "total_fast_memory_gb": null,
  "nvlink_generation": 5,
  "nvlink_domain_gpu_count": 8,
  "nvlink_per_gpu_bandwidth_gbps": 1800,
  "total_nvlink_switch_bandwidth_gbps": 14400,
  "networking": {
    "nic_model": "NVIDIA ConnectX-8 SuperNIC",
    "per_gpu_bandwidth_gbps": null,
    "fabric_options": []
  },
  "power_kw_max": 8.8,
  "cooling_type": "liquid",
  "multi_instance_max": 7,
  "last_verified": "2026-09-06",
  "notes": "Source datasheet publishes 'Total FP8/FP6 Tensor Core: 72 PFLOPS' as one combined figure (72,000 TFLOPS here), and per footnote 2 this is a sparse spec (dense is half) -- both total_fp8_tensor_sparse_tflops and total_fp6_tensor_sparse_tflops carry that value, no independent dense variant given at node-total level. Total figures are vendor-published aggregates (72 PFLOPS, 108/144 PFLOPS FP4, 62 TB/s, 14.4 TB/s), not independently re-derived from per-GPU x 8 by this record -- cross-check: 9000 TFLOPS sparse FP8/GPU x 8 = 72000, consistent. power_kw_max estimated as 8 GPUs x 1100W = 8.8kW (not independently vendor-published for the node alone); flagged via notes rather than sources.",
  "sources": [
    "https://resources.nvidia.com/en-us-blackwell-architecture/blackwell-ultra-datasheet"
  ],
  "_sources": {
    "total_fp4_tensor_sparse_tflops": "https://resources.nvidia.com/en-us-blackwell-architecture/blackwell-ultra-datasheet (p.5, Technical Specifications table)",
    "total_gpu_memory_bandwidth_gbps": "https://resources.nvidia.com/en-us-blackwell-architecture/blackwell-ultra-datasheet (p.5, Technical Specifications table)"
  }
}
