{
  "schema_version": "1.0.0",
  "name": "GB200 NVL72",
  "aliases": [],
  "manufacturer": "NVIDIA",
  "tier": "rack",
  "release_date": null,
  "status": "shipping",
  "gpu_model_ref": "b200-sxm-gb200nvl72.json",
  "gpu_count": 72,
  "cpu_model": "NVIDIA Grace (Arm Neoverse V2)",
  "cpu_count": 36,
  "cpu_core_count_total": 2592,
  "superchip_config": "1 Grace CPU : 2 Blackwell GPUs",
  "total_fp64_tflops": null,
  "total_fp64_tensor_tflops": null,
  "total_fp32_tflops": 5760,
  "total_tf32_tensor_tflops": null,
  "total_tf32_tensor_sparse_tflops": null,
  "total_fp16_bf16_tensor_tflops": null,
  "total_fp16_bf16_tensor_sparse_tflops": null,
  "total_fp8_tensor_tflops": null,
  "total_fp8_tensor_sparse_tflops": 720000,
  "total_fp6_tensor_tflops": null,
  "total_fp6_tensor_sparse_tflops": 720000,
  "total_fp4_tensor_tflops": null,
  "total_fp4_tensor_sparse_tflops": 1440000,
  "total_int8_tensor_tops": null,
  "total_int8_tensor_sparse_tops": null,
  "total_gpu_memory_gb": 13500,
  "total_gpu_memory_bandwidth_gbps": 576000,
  "total_cpu_memory_gb": 17000,
  "total_fast_memory_gb": 30500,
  "nvlink_generation": 5,
  "nvlink_domain_gpu_count": 72,
  "nvlink_per_gpu_bandwidth_gbps": 1800,
  "total_nvlink_switch_bandwidth_gbps": 130000,
  "networking": null,
  "power_kw_max": null,
  "cooling_type": "liquid",
  "multi_instance_max": 7,
  "last_verified": "2026-09-06",
  "notes": "Official NVIDIA Blackwell datasheet's Technical Specifications table (p.7) gives 'Total Fast Memory: Up to 30TB' (30,500 GB used here, matching the 'Up to 30.5TB' figure from the Key Features list on p.2) and 'Supports up to 13.5TB of HBM3E' (also p.2 Key Features; p.7 table gives per-GPU 186GB x 72 = 13,392GB, consistent with the vendor-rounded 13.5TB figure -- 13,500 GB used here as the vendor-stated headline number). total_fp32_tflops (5760) is derived (80 TFLOPS/GPU per p.7 table x 72 GPUs) since no rack-level total FP32 is independently vendor-published; no independent corroboration found yet for this GB200 total (unlike the analogous HGX B200 PCF cross-check) -- flagged as derived, not directly sourced. Per datasheet footnote 1, FP4/FP8/FP6 totals are sparse-spec only. FP8 and FP6 totals published as one combined figure. No total TF32, FP16/BF16, FP64, or INT8 rack-level figures vendor-published; left null. networking left null -- this datasheet does not name a specific NIC/fabric for GB200 NVL72 (mentions InfiniBand generically in performance-comparison footnotes only, not as a spec-table entry); needs a follow-up source (e.g. NVIDIA GB200 NVL72 product page or DGX GB200 datasheet) before populating. power_kw_max not stated in this datasheet; other NVIDIA/partner docs (Supermicro GB200 NVL72 datasheet) independently cite 125-135kW per rack -- left null here rather than treating an analog-document estimate as this record's sourced value.",
  "sources": [
    "https://www.primeline-solutions.com/media/categories/server/nach-gpu/nvidia-hgx-h200/nvidia-blackwell-b200-datasheet.pdf"
  ],
  "_sources": {
    "total_fp4_tensor_sparse_tflops": "https://www.primeline-solutions.com/media/categories/server/nach-gpu/nvidia-hgx-h200/nvidia-blackwell-b200-datasheet.pdf (p.7, Technical Specifications table)",
    "total_nvlink_switch_bandwidth_gbps": "https://www.primeline-solutions.com/media/categories/server/nach-gpu/nvidia-hgx-h200/nvidia-blackwell-b200-datasheet.pdf (p.7, Technical Specifications table)",
    "total_cpu_memory_gb": "https://www.primeline-solutions.com/media/categories/server/nach-gpu/nvidia-hgx-h200/nvidia-blackwell-b200-datasheet.pdf (p.2, Key Features: 'Up to 17 terabytes (TB) of LPDDR5X memory')",
    "total_fast_memory_gb": "https://www.primeline-solutions.com/media/categories/server/nach-gpu/nvidia-hgx-h200/nvidia-blackwell-b200-datasheet.pdf (p.2, Key Features: 'Up to 30.5TB of fast-access memory'; p.7 table rounds to 'Up to 30TB')",
    "total_fp32_tflops": "Derived: 80 TFLOPS/GPU (p.7 Technical Specifications table) x 72 GPUs. Not independently corroborated by a second source at time of writing."
  }
}
