{
  "schema_version": "1.0.0",
  "name": "GB300 NVL72",
  "aliases": [],
  "manufacturer": "NVIDIA",
  "tier": "rack",
  "release_date": null,
  "status": "shipping",
  "gpu_model_ref": "b300-sxm-gb300nvl72.json",
  "gpu_count": 72,
  "cpu_model": "NVIDIA Grace (Arm Neoverse V2)",
  "cpu_count": 36,
  "cpu_core_count_total": 2592,
  "superchip_config": "1 Grace CPU : 2 Blackwell Ultra GPUs",
  "total_fp64_tflops": null,
  "total_fp64_tensor_tflops": null,
  "total_fp32_tflops": null,
  "total_tf32_tensor_tflops": null,
  "total_tf32_tensor_sparse_tflops": null,
  "total_fp16_bf16_tensor_tflops": null,
  "total_fp16_bf16_tensor_sparse_tflops": null,
  "total_fp8_tensor_tflops": null,
  "total_fp8_tensor_sparse_tflops": 720000,
  "total_fp6_tensor_tflops": null,
  "total_fp6_tensor_sparse_tflops": 720000,
  "total_fp4_tensor_tflops": 1080000,
  "total_fp4_tensor_sparse_tflops": 1440000,
  "total_int8_tensor_tops": null,
  "total_int8_tensor_sparse_tops": null,
  "total_gpu_memory_gb": 20000,
  "total_gpu_memory_bandwidth_gbps": 576000,
  "total_cpu_memory_gb": 17000,
  "total_fast_memory_gb": 37000,
  "nvlink_generation": 5,
  "nvlink_domain_gpu_count": 72,
  "nvlink_per_gpu_bandwidth_gbps": 1800,
  "total_nvlink_switch_bandwidth_gbps": 130000,
  "networking": {
    "nic_model": "NVIDIA ConnectX-8 SuperNIC",
    "per_gpu_bandwidth_gbps": 100,
    "fabric_options": ["NVIDIA Quantum-X800 InfiniBand", "Spectrum-X Ethernet"]
  },
  "power_kw_max": null,
  "cooling_type": "liquid",
  "multi_instance_max": 7,
  "last_verified": "2026-09-06",
  "notes": "Source datasheet publishes 'Total FP8/FP6 Tensor Core: 720 PFLOPS' as one combined figure (720,000 TFLOPS here), and per footnote 2 this is a sparse spec (dense is half) -- both total_fp8_tensor_sparse_tflops and total_fp6_tensor_sparse_tflops carry that value, no independent dense variant given at rack-total level. Cross-checks against per-GPU b300-sxm-gb300nvl72.json record: 8000 GB/s/GPU x 72 = 576,000 GB/s (matches total_gpu_memory_bandwidth_gbps); 279GB/GPU x 72 = 20,088GB (~matches vendor-rounded 20 TB); 2,592 CPU cores / 36 Grace CPUs = 72 cores/CPU (consistent with Neoverse V2 72-core config). Networking per_gpu_bandwidth_gbps of 100 GB/s derived from source's '800 Gbps ConnectX-8 per GPU' (800 Gb/s = 100 GB/s), not independently vendor-published in GB/s. power_kw_max not stated in this datasheet; other NVIDIA/Supermicro/partner docs (Supermicro GB200/GB300 NVL72 datasheets) independently cite 120-140kW per rack -- left null here rather than treating an analog-system estimate as this record's sourced value; needs a GB300-specific power source before populating.",
  "sources": [
    "https://resources.nvidia.com/en-us-blackwell-architecture/blackwell-ultra-datasheet"
  ],
  "_sources": {
    "total_fp4_tensor_sparse_tflops": "https://resources.nvidia.com/en-us-blackwell-architecture/blackwell-ultra-datasheet (p.5, Technical Specifications table)",
    "total_nvlink_switch_bandwidth_gbps": "https://resources.nvidia.com/en-us-blackwell-architecture/blackwell-ultra-datasheet (p.5, Technical Specifications table)",
    "total_cpu_memory_gb": "https://resources.nvidia.com/en-us-blackwell-architecture/blackwell-ultra-datasheet (p.2, Key Features)"
  }
}
