{
  "schema_version": "1.0.0",
  "name": "HGX B200",
  "aliases": [],
  "manufacturer": "NVIDIA",
  "tier": "node",
  "release_date": null,
  "status": "shipping",
  "gpu_model_ref": "b200-sxm-hgx.json",
  "gpu_count": 8,
  "cpu_model": null,
  "cpu_count": 0,
  "cpu_core_count_total": null,
  "superchip_config": null,
  "total_fp64_tflops": null,
  "total_fp64_tensor_tflops": null,
  "total_fp32_tflops": 600,
  "total_tf32_tensor_tflops": null,
  "total_tf32_tensor_sparse_tflops": null,
  "total_fp16_bf16_tensor_tflops": null,
  "total_fp16_bf16_tensor_sparse_tflops": null,
  "total_fp8_tensor_tflops": null,
  "total_fp8_tensor_sparse_tflops": 72000,
  "total_fp6_tensor_tflops": null,
  "total_fp6_tensor_sparse_tflops": 72000,
  "total_fp4_tensor_tflops": null,
  "total_fp4_tensor_sparse_tflops": 144000,
  "total_int8_tensor_tops": null,
  "total_int8_tensor_sparse_tops": null,
  "total_gpu_memory_gb": 1400,
  "total_gpu_memory_bandwidth_gbps": 62000,
  "total_cpu_memory_gb": null,
  "total_fast_memory_gb": null,
  "nvlink_generation": 5,
  "nvlink_domain_gpu_count": 8,
  "nvlink_per_gpu_bandwidth_gbps": 1800,
  "total_nvlink_switch_bandwidth_gbps": 14400,
  "networking": null,
  "power_kw_max": 8.0,
  "cooling_type": "air",
  "multi_instance_max": 7,
  "last_verified": "2026-09-06",
  "notes": "Official NVIDIA Blackwell datasheet's 'Technical Specifications' table only gives Total FP4 and Total FP8/FP6 Tensor Core totals for HGX B200 -- no total TF32, FP16/BF16, FP64, or INT8 figures are vendor-published at the node level, left null rather than derived from per-GPU x 8. total_fp32_tflops (600) is derived here (75 TFLOPS/GPU x 8, per-GPU figure is vendor-sourced) since a separate NVIDIA HGX B200 PCF Summary document independently corroborates this exact total (labeled, with an apparent unit typo, as '600 PFLOPS' -- see b200-sxm-hgx.json notes). Per datasheet footnote 1, FP4/FP8/FP6 totals are sparse-spec (dense not independently published for totals). FP8 and FP6 totals published as one combined figure. power_kw_max estimated as 8 GPUs x 1000W = 8.0kW (not independently vendor-published for the node alone). networking left null -- this datasheet does not name a specific NIC model for HGX B200 (unlike the Blackwell Ultra HGX B300 sheet's explicit ConnectX-8 mention); needs a follow-up source (e.g. DGX B200 datasheet) before populating. cooling_type set to 'air' per this datasheet's HGX B200 real-time inference comparisons, which are explicitly 'air-cooled'; liquid-cooled HGX B200 deployments also exist per third-party sources.",
  "sources": [
    "https://www.primeline-solutions.com/media/categories/server/nach-gpu/nvidia-hgx-h200/nvidia-blackwell-b200-datasheet.pdf"
  ],
  "_sources": {
    "total_fp4_tensor_sparse_tflops": "https://www.primeline-solutions.com/media/categories/server/nach-gpu/nvidia-hgx-h200/nvidia-blackwell-b200-datasheet.pdf (p.7, Technical Specifications table)",
    "total_gpu_memory_bandwidth_gbps": "https://www.primeline-solutions.com/media/categories/server/nach-gpu/nvidia-hgx-h200/nvidia-blackwell-b200-datasheet.pdf (p.7, Technical Specifications table)",
    "total_fp32_tflops": "Derived: 75 TFLOPS/GPU (p.7 Technical Specifications table) x 8 GPUs. Independently corroborated by NVIDIA HGX B200 PCF Summary (images.nvidia.com/aem-dam/Solutions/documents/HGX-B200-PCF-Summary.pdf), which lists 'FP32 600 PFLOPS' -- treated as a unit-label typo (TFLOPS, not PFLOPS) in that document rather than a conflicting data point."
  }
}
